name,address,thana,district,brand,capacity,quantity,receipt,type,model,serial
Tasty Treat-Shafipur,"Haji Amjad hossain Super Market, Kaliakair",none,Gazipur,RFL,30,1,359505,Digital weight scale,none,none
Tasty Treat-Gazipur Chowrasta,"805,Auchpara, gazipur Chowrasta, ",none,Gazipur,RFL,30,1,359505,Digital weight scale,none,none
Tasty Treat-Gazipur bypass,"Ahasania Super market ,Vogra Bypass, ",none,Gazipur,RFL,30,1,359505,Digital weight scale,none,none
Tasty Treat-Joydevpur,"Selina Complex .Beside Jhumur cinema hall, Joydebpur",none,Gazipur,RFL,30,1,359505,Digital weight scale,none,none
Tasty Treat-Tongi college gate,"Shop no 13,Tongi pilot school & college market, Tongi",none,Gazipur,RFL,30,1,359505,Digital weight scale,none,none
Tasty Treat-Tongi Bazar,"Anar koli road,Tongi bazar, Tongi",none,Gazipur,RFL,30,1,359505,Digital weight scale,none,none
Tasty Treat-Tongi Bonomala Road,"Tazimuddin Road ,Banamala Tongi, Tongi",none,Gazipur,RFL,30,1,359505,Digital weight scale,none,none
Tasty Treat-Joydevpur-2,"G119,Mosharraf Tower, Joydebpur",none,Gazipur,RFL,30,2,359505,Digital weight scale,none,none
Tasty Treat-Salna Bazar,"Salna Bazar,South Salna, Joydebpur",none,Gazipur,RFL,30,1,359505,Digital weight scale,none,none
Tasty Treat-Kaliakoir,"Tengla bari,College Road Near Bypass, Kaliakair",none,Gazipur,RFL,30,1,359505,Digital weight scale,none,none
Tasty Treat-Board Bazar,"398,haji samiruddin Market ,Gasa, ",none,Gazipur,RFL,30,1,359505,Digital weight scale,none,none
Tasty Treat-Chandana chowrasta,"Majid Mansion ,Joydevpur road ,Chandana Chowrasta, Gazipur Sadar",none,Gazipur,RFL,30,1,359505,Digital weight scale,none,none
Tasty Treat-TT-CHONDRA MORE,"Haji Ahammad ali Super market ,Chandra more, Kaliakair",none,Gazipur,RFL,30,1,359505,Digital weight scale,none,none
Tasty Treat-TT Manikgonj,"1/3, Shahid Rafiq Sarak, Manikganj Sadar",none,Manikganj,RFL,30,1,359505,Digital weight scale,none,none
Tasty Treat-TT Savar Palli Biddut,"Abdul Barek Mondal Market, Palli Biddut, Savar",none,Dhaka,RFL,30,1,359505,Digital weight scale,none,none
Tasty Treat-TT Savar EPZ,"Industrial Trade Centre,EPZ, Savar",none,Dhaka,RFL,30,1,359505,Digital weight scale,none,none
Tasty Treat-TT Singair Bus stand,"540,Riaz mention ,Singair Bus Stand, Singair",none,Manikganj,RFL,30,1,359505,Digital weight scale,none,none
"Tasty Treat-TT Dhamrai Bazar,Dhaka","52/A,Dhamrai Bazar, Dhamrai",none,Dhaka,RFL,30,1,359505,Digital weight scale,none,none
Tasty Treat-TT Jamgora,"Monsur Tower ,Jamgora chowrasta, Ashulia, Savar",none,Dhaka,RFL,30,1,359505,Digital weight scale,none,none
Tasty Treat-TT Bypile,"RMST Tower, Bypile, Ashulia, Savar",none,Dhaka,RFL,30,1,359505,Digital weight scale,none,none
Tasty Treat-TT Ashulia Bus stand,"Ashulia Bus stand, Ashulia, Savar",none,Dhaka,RFL,30,1,359505,Digital weight scale,none,none
Tasty Treat-TT Kalampur Bazar,"Kalampur Bazar, Dhamrai",none,Dhaka,RFL,30,1,359505,Digital weight scale,none,none
Tasty Treat-TT Zirabo,"Zirabo, Ashulia, Savar",none,Dhaka,RFL,30,1,359505,Digital weight scale,none,none
Tasty Treat-TT Niribili,"2301, Road# 1, Falguni Housing, Niribili , Savar cantonment,  Ashulia, Savar",none,Dhaka,RFL,30,1,359505,Digital weight scale,none,none
Tasty Treat-TT Kathgora,"Kathgora, Ashulia, Savar",none,Dhaka,RFL,30,1,359505,Digital weight scale,none,none
Tasty Treat-Middle Badda,"103, Middle Badda Progoti Saroni, Badda",none,Dhaka,RFL,30,1,359505,Digital weight scale,none,none
Tasty Treat-Mohakhali,"67/3, Bir Uttam, AK Khandakar Sarak, Mokhali C/A, Banani",none,Dhaka,RFL,30,1,359505,Digital weight scale,none,none
Tasty Treat-Middle Badda-2,"GA -72/1, Progoti Sarani, Middle Badda, Badda",none,Dhaka,RFL,30,1,359505,Digital weight scale,none,none
Tasty Treat-Gulshan-1,"H#39, Islam Mansion, Road#126, Shop#A-3, Gulshan-1, Gulshan",none,Dhaka,RFL,30,1,359505,Digital weight scale,none,none
Tasty Treat-Baridhara,"Ka-15, Kalachandpur, Gulshan",none,Dhaka,RFL,30,1,359505,Digital weight scale,none,none
Tasty Treat-Tejgoan,"New-79, Shaheed Tajuddin Ahmed Avenue, Tejgoan",none,Dhaka,RFL,30,1,359505,Digital weight scale,none,none
Tasty Treat-Banani,"Tower Hamlet,16 Kamal Attaturk Avenue(Ground Floor), Banani",none,Dhaka,RFL,30,1,359505,Digital weight scale,none,none
Tasty Treat-Niketan Gulshan,"H # 06, Road # 8, Niketan, Gulshan",none,Dhaka,RFL,30,1,359505,Digital weight scale,none,none
Tasty Treat-Baridhara-1,"Intraco Center, Plot#40, Road#9, Block#J, Progoti Soroni",none,Dhaka,RFL,30,1,359505,Digital weight scale,none,none
"Tasty Treat-Bashundhara-2 ,Dhaka","1/C ,Jaggannathpur,Khilkhet, Bashundhara gate",none,Dhaka,RFL,30,1,359505,Digital weight scale,none,none
"Tasty Treat-Merul DIT Project , Dhaka","House#01, Road#12, DIT Project, Merul Badda",none,Dhaka,RFL,30,1,359505,Digital weight scale,none,none
"Tasty Treat-Natunbazar , Dhaka ","H # 12 ,Block # A ,Road # 04 ,Noyabari 100 feet natunbazar",none,Dhaka,RFL,30,1,359505,Digital weight scale,none,none
Tasty Treat-Gulshan - 1 - West,"H-2,R-24, Gulshan-1, Gulshan",none,Dhaka,RFL,30,1,359505,Digital weight scale,none,none
"Tasty Treat-TT Corner at Daily Shopping, Uttar Badda.","Suchona Tower-2; Cha-89/3/A, Progati Sharani, North Badda",none,Dhaka,RFL,30,1,359505,Digital weight scale,none,none
Tasty Treat-TT -Savar Bus Stand,"B-1, Mansur Market, Savar",none,Dhaka,RFL,30,1,359505,Digital weight scale,none,none
Tasty Treat-TT-Live Bakery Savar Thana Road,"B-2, Talbag , Savar",none,Dhaka,RFL,30,3,359505,Digital weight scale,none,none
Tasty Treat-TT-Hemayetpur,"Signgair Road, Hatem Ali Super Market, Hemayetpur, Savar",none,Dhaka,RFL,30,1,359505,Digital weight scale,none,none
Tasty Treat-TT-Talbag Savar,"D-119/3Talbag, Savar ",none,Dhaka,RFL,30,1,359505,Digital weight scale,none,none
Tasty Treat-TT- Savar Shimultola,"B-2/13, Radio colony bus stand ,Savar",none,Dhaka,RFL,30,1,359505,Digital weight scale,none,none
Tasty Treat-TT- Jahangirnagar University,fajitulnesa Hall Jahanginagar University ,none,Dhaka,RFL,30,1,359505,Digital weight scale,none,none
Tasty Treat-TT- Rokeya Hall JU,Rokeya Hall Jahangirnagar University,none,Dhaka,RFL,30,1,359505,Digital weight scale,none,none
Tasty Treat-TT- Daffodil International University,Daffodil International University ,none,Dhaka,RFL,30,1,359505,Digital weight scale,none,none
Tasty Treat-TT-Daffodil University Savar-2,Daffodil International University Food Court,none,Dhaka,RFL,30,1,359505,Digital weight scale,none,none
Tasty Treat-Tasty Treat-Mohammadpur,"Y,14/C, Rajia Sultana Road , Mohammadpur",none,Dhaka,RFL,30,1,359505,Digital weight scale,none,none
Tasty Treat-TT-DHANMONDI,"99, Sat Mosque Road, 11/A, Dhanmondi",none,Dhaka,RFL,30,1,359505,Digital weight scale,none,none
Tasty Treat-Tasty Treat-Outlet-SANKAR,"House#118(New), Road#9/A(New), Dhanmondi",none,Dhaka,RFL,30,1,359505,Digital weight scale,none,none
Tasty Treat-Tasty Treat-Adabor,"H#10, Probal Housing, Road#02, Shaker Tek, Adabor, Mohammadpur",none,Dhaka,RFL,30,1,359505,Digital weight scale,none,none
Tasty Treat-Tasty Treat-S.Room- Shyamoli,"37, Shyamoli Cinema Hall Building, Shyamoli",none,Dhaka,RFL,30,1,359505,Digital weight scale,none,none
Tasty Treat-TT-KATASUR-MOHAMMADPUR,"5/3, Sher-E-Bangla Road, Katasur, Mohammadpur",none,Dhaka,RFL,30,1,359505,Digital weight scale,none,none
Tasty Treat-TT-DHAKA AIRPORT,Dhaka international Airport,none,Dhaka,RFL,30,1,359505,Digital weight scale,none,none
Tasty Treat-TT-LALMATIA-2,"Arong Traffic Signal, 2/1, Block-A, lalmatia, Mohammadpur",none,Dhaka,RFL,30,1,359505,Digital weight scale,none,none
Tasty Treat-Tasty treat - NBR,"Rajashwa Bhaban Plot# F 1/A Agargaon, Sher-E-Bangla Nagar",none,Dhaka,RFL,30,1,359505,Digital weight scale,none,none
Tasty Treat-TT-SNACKS CORNER-DHAKA AIRPORT,Dhaka international Airport,none,Dhaka,RFL,30,1,359505,Digital weight scale,none,none
Tasty Treat-TT-Sorowardi Medical Canteen,Sorowardi Medical College Hospital,none,Dhaka,RFL,30,1,359505,Digital weight scale,none,none
Tasty Treat-TT-Kalshi,"Road-02,Hose-16,Block-E,Kalshi,Mirpur-12",none,Dhaka,RFL,30,1,359505,Digital weight scale,none,none
Tasty Treat-TT-ECB,"ECB,Armi Markat,shop 6/7, Dhaka Cantonment",none,Dhaka,RFL,30,1,359505,Digital weight scale,none,none
Tasty Treat-Shewrapara,"770,West Shewrapara",none,Dhaka,RFL,30,1,359505,Digital weight scale,none,none
Tasty Treat-Kazi para ,"571,East Kazi para ",none,Dhaka,RFL,30,1,359505,Digital weight scale,none,none
Tasty Treat-Mirpir-14,"C B-288, Kachukhet Bazar  Road Dhaka Cantonment",none,Dhaka,RFL,30,1,359505,Digital weight scale,none,none
Tasty Treat-DOSH,"Plot-02 Dosh, sagufta Mirpur Dosh",none,Dhaka,RFL,30,1,359505,Digital weight scale,none,none
Tasty Treat-Taltola ,Shahid Complex 97/1 Agargaon Taltola,none,Dhaka,RFL,30,1,359505,Digital weight scale,none,none
Tasty Treat-TT-FARMGAT,"Indira Road, Leguna stand, Faramgate",none,Dhaka,RFL,30,1,359505,Digital weight scale,none,none
Tasty Treat-TT-PANTHAPATH,"44/9, West West Panthapath",none,Dhaka,RFL,30,1,359505,Digital weight scale,none,none
Tasty Treat-TT-GREEN-ROAD,"20/22,Ground Floor,shop no#01,bir Uttam Safiullah Roan,Green Road",none,Dhaka,RFL,30,1,359505,Digital weight scale,none,none
Tasty Treat-TT-BEPZA,"BEPZA Complex, House#19/D, Road#06, Greenroad, Dhanmondi",none,Dhaka,RFL,30,1,359505,Digital weight scale,none,none
Tasty Treat-TT-BIJOY SARANI,"Shop#01, Airport Road Super Market,  145, Bijoy Saroni, Farmgate (Monipuri Para 1 no Gate).",none,Dhaka,RFL,30,1,359505,Digital weight scale,none,none
Tasty Treat-TT-FARMGATE-2,"79, Green Road, Green View Market, Farmgate",none,Dhaka,RFL,30,1,359505,Digital weight scale,none,none
Tasty Treat-TT-TEJTURI BAZAR FARMGATE-DHAKA,"H # 49, science college road, east Tejturi bazar",none,Dhaka,RFL,30,1,359505,Digital weight scale,none,none
Tasty Treat-TT-SHAHINBAGH TEJGAON,"Road # 12, shahinbag, haji islam shorok, Tejgaon",none,Dhaka,RFL,30,1,359505,Digital weight scale,none,none
Tasty Treat-TT-CIVIL AVIATION SCHOOL,"Civil aviation School & College ,Tejgaon",none,Dhaka,RFL,30,1,359505,Digital weight scale,none,none
Tasty Treat-TT-NAKHALPARA TEJGAON,"605, West Nakhalpara, Tejgaon",none,Dhaka,RFL,30,1,359505,Digital weight scale,none,none
Tasty Treat-TT-NEW MARKET,"House No : 360, Elephant Road, New Market",none,Dhaka,RFL,30,1,359505,Digital weight scale,none,none
Tasty Treat-TT-FACULTY OF BUSINESS STUDIES DU,"Faculty of Business Studies, Dhaka University",none,Dhaka,RFL,30,1,359505,Digital weight scale,none,none
Tasty Treat-TT-TCB BHAVAN,"1, Kawran Bazar, Panthapath Tejgaon link Road",none,Dhaka,RFL,30,1,359505,Digital weight scale,none,none
Tasty Treat-Mirpur bus stand,"1/1, Darus Salam Road, South Bishil, Mirpur-1 Bus-stand",none,Dhaka,RFL,30,1,359505,Digital weight scale,none,none
Tasty Treat- Mirpur Shadin Bangla,"Mirpur 1, Shadin  Bangla Super Mkt, Shop No. : 125,126,127",none,Dhaka,RFL,30,1,359505,Digital weight scale,none,none
Tasty Treat-Kallyanpur,"Shop#23, BRTC Market, Kallyanpur",none,Dhaka,RFL,30,1,359505,Digital weight scale,none,none
Tasty Treat-mirpur 60Feet -2,"Amtola , Mirpur-60 feet road",none,Dhaka,RFL,30,1,359505,Digital weight scale,none,none
Tasty Treat-Mirpur-6,"H # 66, Block # A, Section # 6, Mirpur Old Original-10",none,Dhaka,RFL,30,1,359505,Digital weight scale,none,none
Tasty Treat-mirpur-1,"11, Darus Salam Road, Mirpur-1",none,Dhaka,RFL,30,1,359505,Digital weight scale,none,none
Tasty Treat-Rupnagar-2,"H#17/A, Road#08, Rupnagar R/A, Mirpur",none,Dhaka,RFL,30,1,359505,Digital weight scale,none,none
Tasty Treat-diyabari Rajuk project,"Diyabari Rajuk Project, Uttara, Sector#18",none,Dhaka,RFL,30,1,359505,Digital weight scale,none,none
Tasty Treat-Mirpur-11,"Plot#06, Main Road, Road#03, Section-07, Mirpur-11",none,Dhaka,RFL,30,1,359505,Digital weight scale,none,none
Tasty Treat-Monipur ,"H#10, Probal Housing, Road#02, Shaker Tek, Adabor, Mohammadpur",none,Dhaka,RFL,30,1,359505,Digital weight scale,none,none
Tasty Treat-Rupnagar-1,"27/A/2, Rupnagar R/A, Mirpur",none,Dhaka,RFL,30,1,359505,Digital weight scale,none,none
Tasty Treat-Mir[pur Stadium Gate,"Mirpur Shere-e Bangla Stadium VIP Gate ,House # 40 ,Road # 8,Block # H,Section-2, Mirpur",none,Dhaka,RFL,30,1,359505,Digital weight scale,none,none
Tasty Treat-Mirpur-12,Dhaka international Airport,none,Dhaka,RFL,30,1,359505,Digital weight scale,none,none
Tasty Treat-Mirpur Zoo Road,"1/1 & 1/2, Road#02, Zoo Road, Block-G, Section-1, Mirpur-1",none,Dhaka,RFL,30,1,359505,Digital weight scale,none,none
"Tasty Treat-Joypara Bazar,Dohar","409, Dewan Tower, Joypara bazar, Dohar",none,Dhaka,RFL,30,1,359505,Digital weight scale,none,none
"Tasty Treat-Bagmara Bazar, Nababgonj","869, Jahangir Mention, Bagmara Bazar, Nababgonj",none,Dhaka,RFL,30,1,359505,Digital weight scale,none,none
"Tasty Treat-Hospital Sodor road , Munshiganj ","605,Hospital sodor road,R.K Tower",none,Munsiganj,RFL,30,1,359505,Digital weight scale,none,none
Tasty Treat-Jurain ,"493 , East Jurain ,Hazi K Ali road",none,Dhaka,RFL,30,1,359505,Digital weight scale,none,none
"Tasty Treat-Ati Bazar , Keraniganj","H # 44 ,Ati Bazar ,Keraniganj",none,Dhaka,RFL,30,1,359505,Digital weight scale,none,none
"Tasty Treat-Rohitpur,Keraniganj","House # 26 ,Road# 03 , Rohitpur ,keraniganj",none,Dhaka,RFL,30,1,359505,Digital weight scale,none,none
"Tasty Treat-Kodomtoli , Keraniganj","BT Tower, Kodomtoli Chowrasta, Keranigonj",none,Dhaka,RFL,30,1,359505,Digital weight scale,none,none
"Tasty Treat-Zinzira, Keranigonj","Hauli, Zinzira, Keranigong, (Opposite to press club)",none,Dhaka,RFL,30,1,359505,Digital weight scale,none,none
"Tasty Treat-Bosila ,Mohammadpur","12/A, Riaz Uddin Market, Washpur, Bosila, Mohammadpur",none,Dhaka,RFL,30,1,359505,Digital weight scale,none,none
"Tasty Treat-Sreenagor ,Munshiganj",Sreenagor,none,Munsiganj,RFL,30,1,359505,Digital weight scale,none,none
"Tasty Treat-Ghatail ,Tangail",Ghatail Main Road,none,Tangail,RFL,30,1,359505,Digital weight scale,none,none
"Tasty Treat-Kalihati, Tangail","House-18,Road- Kalihati main road",none,Tangail,RFL,30,1,359505,Digital weight scale,none,none
"Tasty Treat-Modhupur, Tangail","Rasel khan tower,Road- Modhupur bus stand",none,Tangail,RFL,30,1,359505,Digital weight scale,none,none
"Tasty Treat-Alenga , Tangail","1403, Elenga Bus Stand, kalihati",none,Tangail,RFL,30,1,359505,Digital weight scale,none,none
"Tasty Treat-Old Bus stand , Tangail","7, Mobarak complex , Old bus stand",none,Tangail,RFL,30,1,359505,Digital weight scale,none,none
"Tasty Treat-Akurtakur para, Tangail",Akurtakur para,none,Tangail,RFL,30,1,359505,Digital weight scale,none,none
"Tasty Treat-Chasara, Narayangonj","Shop no-103, Al Joynal Trade Center, Chasara",none,Narayanganj,RFL,30,1,359505,Digital weight scale,none,none
"Tasty Treat-Sonargaon, Narayangonj","Anwar Mangil, Bara Nagar, Sonar Gaon",none,Narayanganj,RFL,30,1,359505,Digital weight scale,none,none
"Tasty Treat-Hirajheel , Shiddirganj","Friends Garden, Hirajheel Main Road, East Shiddhir Gonj, CTG Road",none,Narayanganj,RFL,30,1,359505,Digital weight scale,none,none
"Tasty Treat-Nayahati, Shiddhirgonj","191, Amin Market, Mukti Nagar, Naya Hati, Shiddir Gong",none,Narayanganj,RFL,30,1,359505,Digital weight scale,none,none
Tasty Treat-Demra Konapara,"Holding No. 1, Momenbug Chowrasta, Vharadagail, Konapara road, Jatrabari",none,Dhaka,RFL,30,1,359505,Digital weight scale,none,none
"Tasty Treat-Demra Staff quarter,Demra","Hazinagar high school road, staff quarter, Demra",none,Dhaka,RFL,30,1,359505,Digital weight scale,none,none
"Tasty Treat-Staff Quarter Bus stand ,Dhaka","M A Gafur Square Market , Staff quarter bus stand , Demra",none,Dhaka,RFL,30,1,359505,Digital weight scale,none,none
Tasty Treat-Sonir Akhra,"Abedin Bhaban, Ground Floor, Shop#1/1, Sonir Akhra, Kadamtoli, Donia",none,Dhaka,RFL,30,2,359505,Digital weight scale,none,none
Tasty Treat-Rayer Bag Bus stand ,"Plot : 1362,Word no : 61 Mahmudul Haq khan Plaza ,Rayer Bag Bus stand ",none,Dhaka,RFL,30,1,359505,Digital weight scale,none,none
"Tasty Treat-Sonir Akhra-2 ,Dhaka","New -50 ,Old - 36/B,Zia Shoroni ,Polashpur ,Sonir Akhra , 60 no. ward",none,Dhaka,RFL,30,1,359505,Digital weight scale,none,none
"Tasty Treat-Bhuigar, Fatulla, Narayangonj","Aftab Uddin Road, Bhuigar Purbapara, Bhuigar, Fatullah",none,Narayanganj,RFL,30,1,359505,Digital weight scale,none,none
Tasty Treat-TT Wari,"21/12 Ranking Street, Wari",none,Dhaka,RFL,30,1,359505,Digital weight scale,none,none
Tasty Treat-TT-Buddha Mondir,"32/2, Atish Dipankar Road, Sabujbag Buddha Mondir, Basabo",none,Dhaka,RFL,30,1,359505,Digital weight scale,none,none
Tasty Treat-TT-Maniknagor,"114, Maniknagar Biswaroad",none,Dhaka,RFL,30,1,359505,Digital weight scale,none,none
Tasty Treat-TT-Gandaria,"39/4, Old Sarafathgonj Lane, Gandaria",none,Dhaka,RFL,30,1,359505,Digital weight scale,none,none
Tasty Treat-TT-Donia,"421, Anamika Bhaban, Nayapara, Donia",none,Dhaka,RFL,30,1,359505,Digital weight scale,none,none
Tasty Treat-TT-Jatrabari,"101, Shahid Faruk Road, Jatrabari, Al Monir Bhaban",none,Dhaka,RFL,30,1,359505,Digital weight scale,none,none
"Tasty Treat-TT-Sontek , Jatrabari","326 , Habib khan Tower, sontek, Jatrabari",none,Dhaka,RFL,30,1,359505,Digital weight scale,none,none
"Tasty Treat-TT-Dholpur,Jatrabari","60/1/A, Bramon Chiron, Golapbagh, Dhalpur",none,Dhaka,RFL,30,1,359505,Digital weight scale,none,none
"Tasty Treat-TT-Modina bagh, Uttar Mugda","58/34/7/1 ,Madinabag,Uttar Mugda",none,Dhaka,RFL,30,1,359505,Digital weight scale,none,none
"Tasty Treat-TT-North Jatrabari, Dhaka","72,  North Jatrabari",none,Dhaka,RFL,30,1,359505,Digital weight scale,none,none
"Tasty Treat-TT-Dolaipar Bazar, Dhaka","668, East Dolaipar Bazar, Kadamtoli",none,Dhaka,RFL,30,1,359505,Digital weight scale,none,none
Tasty Treat-TT-Live Bakery Mugdha,"153-155, Family Hamid Tower, South Mugdha, Sabujbag",none,Dhaka,RFL,30,2,359505,Digital weight scale,none,none
Tasty Treat-TT-South Banasree,K -17 south Banasree main road,none,Dhaka,RFL,30,1,359505,Digital weight scale,none,none
Tasty Treat-TT-Khilgaon,"399/B Shahid Baki Road, khilgaon",none,Dhaka,RFL,30,1,359505,Digital weight scale,none,none
Tasty Treat-TT-Goran,"76, East Goran, Khilgoan",none,Dhaka,RFL,30,1,359505,Digital weight scale,none,none
Tasty Treat-TT-Aftabnagar,"A/7, Aftabnagar Main Road, Merul Badda",none,Dhaka,RFL,30,1,359505,Digital weight scale,none,none
Tasty Treat-TT-Banasree-E,"Plot No # 48, Road# 4, Banasree -E Block Main Road",none,Dhaka,RFL,30,1,359505,Digital weight scale,none,none
Tasty Treat-TT-Khilgoan Chowrasta,"401/A, Khilgoan Chowrasta, Khilgoan",none,Dhaka,RFL,30,1,359505,Digital weight scale,none,none
Tasty Treat-TT-Banasree-A,"Plot#5,7,11, Road#5/1, Block#A, Bonosree, Rampura",none,Dhaka,RFL,30,1,359505,Digital weight scale,none,none
Tasty Treat-TT-Rampura Bazar,"278, West Rampura Bazar, Rampura",none,Dhaka,RFL,30,1,359505,Digital weight scale,none,none
Tasty Treat-TT-Bonosree#C,"House # 15, Block # C, Banasree Main Road",none,Dhaka,RFL,30,1,359505,Digital weight scale,none,none
Tasty Treat-TT-Basabo -1,"Mohiuddin Nibash, 98/1, East Basabo",none,Dhaka,RFL,30,1,359505,Digital weight scale,none,none
Tasty Treat-TT-Banosree # B,"A M tower, Road 1, Banasree B Block",none,Dhaka,RFL,30,1,359505,Digital weight scale,none,none
Tasty Treat-TT-South Bonosree-2,"B-63, Main Road, South Bonosree, Block#B, Estern Housing",none,Dhaka,RFL,30,1,359505,Digital weight scale,none,none
Tasty Treat-TT-Bonosree # J,"House#2, Road#6, Block#J, Avenue Road, Bonosree",none,Dhaka,RFL,30,1,359505,Digital weight scale,none,none
Tasty Treat-TT-Basabo-2,"213, Middle Basaboo, 19 Atish Dipankar Road, Sabujbag",none,Dhaka,RFL,30,1,359505,Digital weight scale,none,none
Tasty Treat-TT-Khilgoan Tilpa para,"298/A, Tilpa Para, Khilgoan",none,Dhaka,RFL,30,1,359505,Digital weight scale,none,none
"Tasty Treat-TT-Mohanagor project , Rampur","H#4, Road#4, Mahanagar Project, Rampura",none,Dhaka,RFL,30,1,359505,Digital weight scale,none,none
"Tasty Treat-TT-Modhubagh , Moghbazar","394, Modhubagh, Mogbazar",none,Dhaka,RFL,30,1,359505,Digital weight scale,none,none
Tasty Treat-TT-Rampura -2,"356, East Rampura, DIT road",none,Dhaka,RFL,30,1,359505,Digital weight scale,none,none
"Tasty Treat-TT-Shantinagar, Dhaka","148, Shantinagar Road, Shantinagar",none,Dhaka,RFL,30,1,359505,Digital weight scale,none,none
Tasty Treat-TT-Rajarbagh police line,"Rajarbagh Police Lines, Rajarbag",none,Dhaka,RFL,30,1,359505,Digital weight scale,none,none
Tasty Treat-TT-KANDAPARA NAR.,"H#O2,Dokhin kandapara, narsingdi sadar",none,Narsingdi,RFL,30,1,359505,Digital weight scale,none,none
Tasty Treat-TT Narsingdi Sadar,"Nannu molla super market, DC Road, Narsingdi sadar",none,Narsingdi,RFL,30,1,359505,Digital weight scale,none,none
Tasty Treat-Tt Ghorashal Highway,"Beside PRAN-RFL School,polash",none,Narsingdi,RFL,30,1,359505,Digital weight scale,none,none
Tasty Treat-TT - Danga,"CTL Danga,polash",none,Narsingdi,RFL,30,1,359505,Digital weight scale,none,none
Tasty Treat-TT Palash Bazar,"Wapda gate, notun bazar, polash",none,Narsingdi,RFL,30,1,359505,Digital weight scale,none,none
Tasty Treat-TT-RIP Factory,"RIP Factory canteen , polash",none,Narsingdi,RFL,30,1,359505,Digital weight scale,none,none
Tasty Treat-TT-Shibpur bazar ,"H.B Tower ,shibpur sadar road",none,Narsingdi,RFL,30,1,359505,Digital weight scale,none,none
Tasty Treat-Nar.College gate,"Narsingdi College gate, Narsingdi sadar",none,Narsingdi,RFL,30,1,359505,Digital weight scale,none,none
Tasty Treat-TT Ghorashal Bazzar ,"Station road ,Ghorashal bazar,polash",none,Narsingdi,RFL,30,1,359505,Digital weight scale,none,none
Tasty Treat-Tasty Treat Gausia,"Goal chottor,vulta gousia, Rupgonj",none,Narayanganj,RFL,30,1,359505,Digital weight scale,none,none
Tasty Treat-TT-Araihazar,"Latif bhuyan market,college road, Araihazar",none,Narayanganj,RFL,30,1,359505,Digital weight scale,none,none
Tasty Treat-Tikatuli,"2/F, Avoy Das Lane, Takatuli, Wari",none,Dhaka,RFL,30,1,359505,Digital weight scale,none,none
Tasty Treat-Gopibagh,"Shop#11, 53-53/1, Neer Chaya Bithi, R.K Mission Road, Gopibagh ",none,Dhaka,RFL,30,1,359505,Digital weight scale,none,none
"Tasty Treat-Kakrail,Dhaka","89/1,Kakrail road ,Kakrail",none,Dhaka,RFL,30,1,359505,Digital weight scale,none,none
"Tasty Treat-Mouchak ,Dhaka","238/1,Maruf Market,Mouchak Mor, Malibagh",none,Dhaka,RFL,30,1,359505,Digital weight scale,none,none
"Tasty Treat-Purana Polton-2,Dhaka","11, Purana Polton",none,Dhaka,RFL,30,1,359505,Digital weight scale,none,none
"Tasty Treat-DR Tower, Dhaka","DR Tower, Puraton polton",none,Dhaka,RFL,30,1,359505,Digital weight scale,none,none
"Tasty Treat-Doinik Banglar Mor, Dhaka","28-A/2-1, DIT Extension road, Fokirapool, Motijheel",none,Dhaka,RFL,30,1,359505,Digital weight scale,none,none
"Tasty Treat-Birdem Hospital, Shahbag, Dhaka",122 Kazi Nazrul Islam Ave,none,Dhaka,RFL,30,1,359505,Digital weight scale,none,none
Tasty Treat-Tasty Treat-Ibrahim Cardiac Hospital,122 Kazi Nazrul Islam Ave,none,Dhaka,RFL,30,1,359505,Digital weight scale,none,none
"Tasty Treat-Birdem  -2, Segun Bagicha, Dhaka",1/A Segun Bagicha Rd,none,Dhaka,RFL,30,1,359505,Digital weight scale,none,none
Tasty Treat-Motijheel,"34/4 kamalapur kachabazar road,motijheel",none,Dhaka,RFL,30,1,359505,Digital weight scale,none,none
Tasty Treat-Bijoynagar,"169, Shahid Sayed Nazrul Islam Saroni, Bijoynagar",none,Dhaka,RFL,30,1,359505,Digital weight scale,none,none
Tasty Treat-Nayapolton,"43, Naya Paltan",none,Dhaka,RFL,30,1,359505,Digital weight scale,none,none
Tasty Treat-Baily Road,"143/2, New Baily Road, A Q P ",none,Dhaka,RFL,30,1,359505,Digital weight scale,none,none
"Tasty Treat-Eskaton road ,Dhaka","84,New Eskaton road",none,Dhaka,RFL,30,1,359505,Digital weight scale,none,none
Tasty Treat-Moughbazar,"70-71, Outer Circular Road, Moghbazar",none,Dhaka,RFL,30,1,359505,Digital weight scale,none,none
Tasty Treat-Uttara-6,"H#1, Road#13, Sector#6, Uttara",none,Dhaka,RFL,30,1,359505,Digital weight scale,none,none
Tasty Treat-Nikunja,"H#32, Road#01, Nikunja-2",none,Dhaka,RFL,30,1,359505,Digital weight scale,none,none
Tasty Treat-Uttara#13,"18, Gausal Azam Avenue, Quantum Mostafa Tower, Sector 13, Uttara",none,Dhaka,RFL,30,1,359505,Digital weight scale,none,none
Tasty Treat-Ashkona,"27, Hazi Komor Uddin Tower, Ashkona",none,Dhaka,RFL,30,1,359505,Digital weight scale,none,none
Tasty Treat-Khilkhet,"A/56, Khilkhet Bazar, Khilkhet",none,Dhaka,RFL,30,1,359505,Digital weight scale,none,none
"Tasty Treat-Azampur Kacha Bazar, Dakhinkhan ,Dhaka","House# 141, Shah Kabir Mazar Road, Azampur Kachabazar, Dokhinkhan",none,Dhaka,RFL,30,1,359505,Digital weight scale,none,none
Tasty Treat-Uttara Sector-9,"Plot # 03,Road# 1/B,Sector # 09,House Building , Opposite of Mascot Plaza ,Uttara",none,Dhaka,RFL,30,1,359505,Digital weight scale,none,none
Tasty Treat-Uttara-12,"Uttara sectore-12 , shah makdum avenue - house-39",none,Dhaka,RFL,30,2,359505,Digital weight scale,none,none
Tasty Treat-Uttara-10,"Uttara sector-10, road-13, house-33",none,Dhaka,RFL,30,1,359505,Digital weight scale,none,none
Tasty Treat-uttara-5,"Uttara sector-5, road-1, house-38",none,Dhaka,RFL,30,1,359505,Digital weight scale,none,none
Tasty Treat-TT-Bakshi bazar,"19, Bakshibazar",none,Dhaka,RFL,30,1,359505,Digital weight scale,none,none
Tasty Treat-TT-Satrawja,"21,Abul Hasnat Road,Satrowza",none,Dhaka,RFL,30,1,359505,Digital weight scale,none,none
Tasty Treat-TT-Azimpur,44/A/1/2 Shapra mashjid Azimur,none,Dhaka,RFL,30,1,359505,Digital weight scale,none,none
Tasty Treat-TT-Kamrangir Char,"12, Ashrababad Main Road, Ismail Mention, kamrangirchar",none,Dhaka,RFL,30,1,359505,Digital weight scale,none,none
Tasty Treat-TT-Lalbagh Kella,"1No Lalbagh Road,Lalbagh",none,Dhaka,RFL,30,1,359505,Digital weight scale,none,none
Tasty Treat-TT-LAXMIBAZAR,"Puran Dhaka 20/21 Suvas ghos Aveneue, Laxmibazar, Sutrapur",none,Dhaka,RFL,30,1,359505,Digital weight scale,none,none
Tasty Treat-TT-Nazimuddin Road,"27,Rajonigondha House, Nazimuddin Road",none,Dhaka,RFL,30,1,359505,Digital weight scale,none,none
Tasty Treat-TT-Lalbug,"4/1/2 Azimpur Road, Lalbagh",none,Dhaka,RFL,30,2,359505,Digital weight scale,none,none
